{
    "$schema": "http://json-schema.org/draft-07/schema#",
    "type": "object",
    "required": ["name", "email", "age", "address", "phoneNumbers"],
    "properties": {
        "name": {
            "type": "string",
            "pattern": "^[A-Za-z\\s]+$"
        },
        "email": {
            "type": "string",
            "format": "email"
        },
        "age": {
            "type": "integer",
            "minimum": 0,
            "maximum": 120
        },
        "address": {
            "type": "object",
            "required": ["street", "city", "country"],
            "properties": {
                "street": {
                    "type": "string"
                },
                "city": {
                    "type": "string"
                },
                "country": {
                    "type": "string"
                }
            }
        },
        "phoneNumbers": {
            "type": "array",
            "items": {
                "type": "object",
                "required": ["type", "number"],
                "properties": {
                    "type": {
                        "type": "string",
                        "enum": ["home", "mobile", "work"]
                    },
                    "number": {
                        "type": "string",
                        "pattern": "^[0-9]{3}-[0-9]{3}-[0-9]{4}$"
                    }
                }
            }
        }
    }
} 