{
    "name": "John Doe",
    "email": "john.doe@example.com",
    "age": 30,
    "address": {
        "street": "123 Main St",
        "city": "New York",
        "country": "USA"
    },
    "phoneNumbers": [
        {
            "type": "home",
            "number": "212-555-1234"
        },
        {
            "type": "mobile",
            "number": "646-555-4567"
        }
    ]
} 